{
  "schema_version": "tools-handoff-maintenance/1.0.0",
  "manual_id": "tools",
  "release_status": "unapproved-handoff-verified",
  "owner": "Tools maintainers",
  "program": {
    "epic": 4707,
    "subepic": 4730
  },
  "repository": "D-sorganization/Tools",
  "issue_url": "https://github.com/D-sorganization/Tools/issues/4730",
  "pr_url": "https://github.com/D-sorganization/Tools/pull/5573",
  "commit_evidence": {
    "local_head_sha": "e5e2c92acc7cd95b1188295ef758a3090f69c6b6",
    "remote_head_sha": null,
    "reviewed_tree_sha": "1fce622e4b1b98c472c97bfef88d796f35109694",
    "merge_sha": null
  },
  "branch_and_worktree": {
    "branch": "codex/signal-optimized-structural-guards",
    "worktree": "/home/dieterolson/.codex/worktrees/tools-signal-optimized/Tools",
    "is_clean": false
  },
  "check_evidence": {
    "check_design_manual_governance": {
      "command": "python -m scripts.check_design_manual_governance",
      "status": "passed",
      "timestamp": "2026-10-12T07:47:12Z"
    },
    "build_tools_module_inventory": {
      "command": "python -m scripts.build_tools_module_inventory --check",
      "status": "passed",
      "timestamp": "2026-10-12T07:47:12Z"
    },
    "lint_tools_textbook_chapters": {
      "command": "python -m scripts.lint_tools_textbook_chapters",
      "status": "passed",
      "timestamp": "2026-10-12T07:47:12Z"
    },
    "check_tools_exemplars": {
      "command": "python -m scripts.check_tools_exemplars",
      "status": "passed",
      "timestamp": "2026-10-12T07:47:12Z"
    },
    "check_tools_calculation_freshness": {
      "command": "python -m scripts.check_tools_calculation_freshness --check",
      "status": "passed",
      "timestamp": "2026-10-12T07:47:12Z"
    },
    "check_tools_manual_qa": {
      "command": "python -m scripts.check_tools_manual_qa --check",
      "status": "passed",
      "timestamp": "2026-10-12T07:47:12Z"
    },
    "check_tools_publication_projection": {
      "command": "python -m scripts.check_tools_publication_projection --check",
      "status": "passed",
      "timestamp": "2026-10-12T07:47:12Z"
    },
    "render_tools_design_manual": {
      "command": "python -m scripts.render_tools_design_manual --check",
      "status": "passed",
      "timestamp": "2026-10-12T07:47:12Z"
    },
    "check_tools_handoff": {
      "command": "python -m scripts.check_tools_handoff --check",
      "status": "passed",
      "timestamp": "2026-10-12T07:47:12Z"
    }
  },
  "artifact_and_test_digests": {
    "calculation_registry_sha256": "a1bc45cb5f76e36b1488bc508a05acd800167776f7ebd5b825ea272ba93910a6",
    "toolchain_lock_sha256": "62915da70f09da3fead98ae71ccb94c2afaec7db2de390faa97234e103426b9b",
    "artifacts_manifest_sha256": "3c807d8307cdaf7c11e7ef526a6c1f7f6cbfd2e9f0895b6c75b5c11879933ff8",
    "qa_ledger_sha256": "61cb0d30ae7da23c6b18efd5cf72458ef4904268a5e0c7dd4b16539046c00ff2",
    "publication_projection_sha256": "df4f5f1c815f9b969a6e8a9fd869e56795ef3b19fe79adeb19cf6af6f8dd77f2",
    "artifacts_sha256": {
      "docx": {
        "path": "manuals/tools/dist/tools-engineering-design-manual.docx",
        "media_type": "application/vnd.openxmlformats-officedocument.wordprocessingml.document",
        "bytes": 82413,
        "sha256": "38233a9391e0fc8a0a62301924b02c6ad510646d8c5993daf05fb1afa3f60346"
      },
      "html": {
        "path": "manuals/tools/dist/tools-engineering-design-manual.html",
        "media_type": "text/html",
        "bytes": 134654,
        "sha256": "08a31180d6bb4b955fe5adbbc8018d0a308ca64279b12588a6ffe227195466d6"
      },
      "pdf": {
        "path": "manuals/tools/dist/tools-engineering-design-manual.pdf",
        "media_type": "application/pdf",
        "bytes": 340120,
        "sha256": "335bb58228b8dc85d667ca5c640f50656f891a690c3b67100abb7814b84d36e0"
      },
      "tex": {
        "path": "manuals/tools/dist/tools-engineering-design-manual.tex",
        "media_type": "application/x-tex",
        "bytes": 63934,
        "sha256": "1ca47faae39ca6b5cb856501d62da31a93efe2d66e9862b69a8728656b7c1999"
      }
    }
  },
  "limitations": [
    "Formal human sign-off on design manual publication and production release remains pending TOOLS-HUMAN-APPROVAL-PENDING.",
    "Markerless motion-capture exemplar remains blocked on TOOLS-M0 issue #4708 and PR #4734.",
    "Visual baselines are produced on Linux fleet runners and cannot be regenerated in local Windows environments without candidate download."
  ],
  "approvals_and_expiry": {
    "state": "unapproved-handoff-verified",
    "blockers": [
      "TOOLS-HUMAN-APPROVAL-PENDING",
      "TOOLS-MARKERLESS-EXEMPLAR-BLOCKED"
    ],
    "expiry_timestamp": "2027-01-10T07:47:12Z"
  },
  "blockers": [
    {
      "id": "TOOLS-HUMAN-APPROVAL-PENDING",
      "owner": "Lead systems maintainers",
      "resolution": "Publication projection and release approval remain blocked pending formal human sign-off on page review, accessibility, and completion audit."
    },
    {
      "id": "TOOLS-MARKERLESS-EXEMPLAR-BLOCKED",
      "owner": "TOOLS-M0 issue #4708 and TOOLS-D4 issue #4720",
      "resolution": "Merge markerless authority contracts through protected review, then register source-backed calculation and textbook chapter without copying unmerged code."
    }
  ],
  "next_dependency": "TOOLS-M0 (#4708 / #4734) and parent epic DOC-TOOLS (#4707) closure",
  "freshness_timestamp": "2026-10-12T07:47:12Z",
  "governed_handoff_files": {
    "AGENT_HANDOFF.md": {
      "path": "AGENT_HANDOFF.md",
      "sha256_lf": "c1c797ff1b078721f8b560bb3936a21d9094553f441eae63de04e29dfe7e0655",
      "line_count": 147,
      "max_line_budget": 150,
      "required_sections": [
        "## Verified Agent Context: #5138",
        "## Calibration and Moving Reference Placements: #5132 / #5137",
        "## Impact Dynamics and Acoustics: #5068",
        "## Merge Governance",
        "## Where This Repo Is Headed",
        "## Active Delivery Boundaries",
        "## Must-Read Architecture Pointers",
        "## Gate Commands (Repo-Wide)",
        "## Do-Not List",
        "## Short-Term Roadmap (Ordered)",
        "## PR Disposition \u2014 2026-09-07/08 Fleet Backlog Sweep (Tools, 22 open PRs)",
        "## Native State Replay Development (#5470)"
      ]
    },
    "src/pendulum_simulator/AGENT_HANDOFF.md": {
      "path": "src/pendulum_simulator/AGENT_HANDOFF.md",
      "sha256_lf": "73eb970447c20cd032d7342cd12e2f4dec4f5892d75e03a37015039db82e6158",
      "line_count": 58,
      "max_line_budget": 150,
      "required_sections": [
        "## Where This Tool Is Headed",
        "## Active Epics \u2014 #4766 objectives, #4775 actuation and realism",
        "## Must-Read Architecture Pointers",
        "## Gate Commands (this tool)",
        "## Do-Not List",
        "## Roadmap (ordered)"
      ]
    },
    "src/putting_launch_monitor/AGENT_HANDOFF.md": {
      "path": "src/putting_launch_monitor/AGENT_HANDOFF.md",
      "sha256_lf": "0c7477ffd718b005fe12c0ca7254ffc4cd1aea6fe4864878943c56cafb3723cd",
      "line_count": 109,
      "max_line_budget": 150,
      "required_sections": [
        "## Repository and Working Directory",
        "## What Is Done (and Measured)",
        "## GUI (`ui/pyqt6/`, entry `main_window.main`)",
        "## The Lab Setup, As Calibrated",
        "## Gate Commands",
        "## Do Not",
        "## Ordered Next Steps (agents; each has an issue under #5218)"
      ]
    },
    "src/rate_of_closure/AGENT_HANDOFF.md": {
      "path": "src/rate_of_closure/AGENT_HANDOFF.md",
      "sha256_lf": "50fa4544cf64f07e1bd83ccfa3e68a497a936638c876702e58243be1d7eddcd1",
      "line_count": 62,
      "max_line_budget": 150,
      "required_sections": [
        "## What This Tool Is Now",
        "## Active Epics \u2014 Golf Epics Merged",
        "## Renderer provenance #5303",
        "## Must-Read Architecture Pointers",
        "## Gate Commands (This Tool)",
        "## Do-Not List"
      ]
    },
    "src/rotation_converter/AGENT_HANDOFF.md": {
      "path": "src/rotation_converter/AGENT_HANDOFF.md",
      "sha256_lf": "ebaddae562be5663d591de4c95851b52263f81c027966071a22748d8558559d4",
      "line_count": 76,
      "max_line_budget": 150,
      "required_sections": [
        "## Where This Tool Is Headed",
        "## Recent Activity (grounding \u2014 `git log --oneline -15 -- src/rotation_converter`)",
        "## Must-Read Architecture Pointers",
        "## Gate Commands (this tool)",
        "## Do-Not List",
        "## Roadmap (ordered)"
      ]
    },
    "src/shared/python/golf_club/AGENT_HANDOFF.md": {
      "path": "src/shared/python/golf_club/AGENT_HANDOFF.md",
      "sha256_lf": "46e1de2927bf74621250401286388fa5a6f4550487e47f650e7e9380ad228f4b",
      "line_count": 150,
      "max_line_budget": 150,
      "required_sections": [
        "## Impact Dynamics Review: #5068 / #5069",
        "## Stack and Integration Position",
        "## Club Fitting Tester Epic (#4549) \u2014 COMPLETED (#4557, #4577)",
        "## Heavy Hit Epic (#4562) \u2014 COMPLETED (#4568, #4577)",
        "## Putting Epic #4800 \u2014 P3 putter head, P5 putter fitting",
        "## Current CAD and Export Contract",
        "## Focused Verification",
        "## Residual #4149 / #4146 Scope"
      ]
    },
    "src/shared/python/sidekick/lab/mocap/AGENT_HANDOFF.md": {
      "path": "src/shared/python/sidekick/lab/mocap/AGENT_HANDOFF.md",
      "sha256_lf": "444bf9c9549707ee5db438c64cb58b717b96125f5ed0551236159a6906df42fa",
      "line_count": 89,
      "max_line_budget": 150,
      "required_sections": [
        "## Authority",
        "## Feedback-Control Replay Contract \u2014 #5461",
        "## Feedback-Control Evidence Interchange \u2014 #5462",
        "## Bounded Experiment Resources and Preview Manifests \u2014 #5463",
        "## Active issues",
        "## Current branch",
        "## Delivered in this slice",
        "## Required gates",
        "## Do not"
      ]
    }
  }
}
